Scenario,Seed,Average_driving_time,Total_waiting_time,Average_waiting_time,Categories,Broken_bridges,Average Speed
4,553952,0,1771,0,"A, B, A, C, A, A, C, C, A, B, A, B, B, B, A, C, C, A, B, B, A, A, C, B, C, B, A, B, A, A, A, C, A, C, B, C, C, B, C, C, A, B, C, C, C, A, A, C, B, C, C, C, A, B, A","N1_791, N1_1000, N1_20, N1_839, N1_205, N1_1026, N1_320, N1_253, N1_230, N1_825, N1_908, N1_348, N1_853, N1_491, N1_981, N1_414, N1_1076, N1_990, N1_885, N1_27, N1_438, N1_487, N1_73, N1_428, N1_873, N1_985, N1_228, N1_460, N1_65, N1_83, N1_766, N1_446, N1_576, N1_906, N1_366, N1_920, N1_942, N1_156, N1_1022, N1_287, N1_450, N1_38, N1_771, N1_406, N1_462, N1_1019, N1_800, N1_317, N1_833, N1_939, N1_979, N1_596, N1_43, N1_918, N1_17",0
4,691163,0,1769,0,"A, A, A, A, C, B, B, A, C, A, A, A, A, B, A, A, A, A, A, B, A, C, A, A, A, C, D, C, C, B, C, A, C, D, C, C, A, A, D, C, D, A, C, A, A, C, A, A, A","N1_496, N1_1065, N1_40, N1_320, N1_792, N1_363, N1_776, N1_1053, N1_112, N1_266, N1_682, N1_850, N1_64, N1_806, N1_886, N1_611, N1_899, N1_48, N1_975, N1_801, N1_207, N1_812, N1_670, N1_108, N1_870, N1_487, N1_865, N1_1059, N1_717, N1_558, N1_746, N1_946, N1_920, N1_690, N1_788, N1_619, N1_693, N1_826, N1_930, N1_934, N1_467, N1_833, N1_879, N1_999, N1_935, N1_435, N1_43, N1_518, N1_754",0
4,572972,0,1772,0,"A, A, A, C, B, C, B, B, B, B, B, B, A, A, B, B, B, B, A, B, C, A, A, A, A, C, A, A, B, C, C, B, C, B, C, D, C, C, C, D, A, A, B, C, C, D, A, A, C","N1_837, N1_1041, N1_718, N1_505, N1_309, N1_396, N1_498, N1_56, N1_799, N1_431, N1_520, N1_850, N1_241, N1_226, N1_912, N1_661, N1_956, N1_1023, N1_1076, N1_188, N1_594, N1_1081, N1_873, N1_25, N1_884, N1_95, N1_136, N1_678, N1_1047, N1_124, N1_245, N1_502, N1_513, N1_664, N1_1010, N1_1049, N1_132, N1_771, N1_772, N1_930, N1_800, N1_803, N1_189, N1_536, N1_677, N1_1071, N1_731, N1_417, N1_36",0
4,774278,0,1754,0,"C, C, B, A, C, C, A, B, B, A, B, A, B, A, C, B, C, B, A, A, A, A, A, A, B, A, B, C, C, C, C, C, C, C, C, A, D, C, C, B, A, A, C, C, B, C, B, A, B","N1_796, N1_837, N1_1041, N1_1000, N1_149, N1_1065, N1_309, N1_498, N1_914, N1_845, N1_380, N1_656, N1_1012, N1_701, N1_606, N1_968, N1_899, N1_328, N1_956, N1_739, N1_801, N1_191, N1_425, N1_108, N1_990, N1_1042, N1_873, N1_460, N1_731, N1_797, N1_920, N1_938, N1_212, N1_287, N1_1078, N1_872, N1_406, N1_686, N1_716, N1_410, N1_115, N1_893, N1_73, N1_452, N1_178, N1_884, N1_635, N1_780, N1_165",0
4,421327,0,1761,0,"C, A, C, C, C, B, B, A, A, A, B, C, B, C, C, B, C, A, A, A, A, A, A, A, A, A, B, A, B, A, D, B, D, A, C, A, C, A, A, C, D, C, C, C, B, B, B, D, A","N1_32, N1_421, N1_1026, N1_896, N1_205, N1_913, N1_386, N1_784, N1_701, N1_346, N1_825, N1_334, N1_381, N1_850, N1_473, N1_272, N1_503, N1_425, N1_578, N1_70, N1_1042, N1_855, N1_873, N1_1064, N1_460, N1_95, N1_617, N1_775, N1_602, N1_861, N1_747, N1_778, N1_788, N1_1049, N1_161, N1_559, N1_924, N1_532, N1_930, N1_1019, N1_868, N1_996, N1_999, N1_716, N1_589, N1_189, N1_1032, N1_780, N1_143",0
