Scenario,Seed,Average_driving_time,Total_waiting_time,Average_waiting_time,Categories,Broken_bridges
2,399247,233.28530397319292,453155,216.92436572522737,"C, D, C, C, C, C, C, C, D, C, D","N1_929, N104_38, N1_788, N204_38, N1_520, N207_6, N2_209, N2_264, N1_917, N2_153, N207_66"
2,342620,189.6479275845641,362954,172.91757979990473,"C, C, C, C, C, C, C, C, D, C, C, C","N1_828, N2_541, N1_935, N102_22, N1_905, N1_986, N1_873, N207_78, N1_914, N106_110, N2_170, N1_95"
2,534860,178.25153955471342,336604,159.45239223117005,"C, C, D, D, C, C, C, C, C","N2_218, N1_1049, N106_36, N1_850, N1_792, N106_11, N106_118, N106_43, N1_132"
2,889940,108.5130963517306,185374,86.7043966323667,"C, C, C, C, C, C","N2_541, N1_1019, N1_920, N1_833, N1_817, N1_797"
2,739830,278.71139971139974,548030,263.6026936026936,"C, C, C, C, C, C, D, C, C, C, D, C, C, C, D","N1_772, N1_178, N1_905, N106_38, N2_147, N2_23, N105_1, N2_54, N102_12, N207_88, N106_11, N104_71, N106_90, N1_931, N104_16"
